{"generado":"2026-10-17T17:13:24Z","fuentes":[{"fuente_id":"sectur-ot-2026-06","titulo":"Datos del Observatorio Turístico a junio 2026 (con glosario)","institucion":"Secretaría de Desarrollo Turístico del Estado de Puebla","tipo":"oficial","url":"https://sectur.puebla.gob.mx/observatorioturistico/documentospdf/DatosOT%20a%20junio%202026%20glosario.pdf","fecha_consulta":"2026-10-15","uso_en_el_proyecto":"Serie mensual 2017-2026 por centro turístico: cuartos; llegadas; ocupación; afluencia; derrama"},{"fuente_id":"sectur-obs-verano-2024","titulo":"Informe Observatorio Turístico vacaciones de verano 2024","institucion":"Secretaría de Desarrollo Turístico del Estado de Puebla","tipo":"oficial","url":"https://sectur.puebla.gob.mx/observatorioturistico/documentospdf/RESULTADOSOBSERVTAORIOTURISTICODEPUEBLA2024VERANO.pdf","fecha_consulta":"2026-10-15","uso_en_el_proyecto":"Medio por el que el visitante se enteró del destino (redes sociales 39.7 %)"},{"fuente_id":"sectur-obs-2024-buap","titulo":"Resultados del Observatorio Turístico informe 2024 (con BUAP)","institucion":"Secretaría de Desarrollo Turístico del Estado de Puebla / BUAP","tipo":"oficial","url":"https://sectur.puebla.gob.mx/observatorioturistico/documentospdf/RESULTADOS-OBSERVATORIO-TURISTICO.pdf","fecha_consulta":"2026-10-15","uso_en_el_proyecto":"Medio por el que se enteró (TV 46.6 %; redes sociales 28.8 %)"},{"fuente_id":"sectur-mercado-2020","titulo":"Estudio de mercado en el sector turístico (octubre 2020)","institucion":"Secretaría de Turismo del Estado de Puebla / BEAP S.C.","tipo":"oficial","url":"https://sectur.puebla.gob.mx/observatorioturistico/documentospdf/estudiodemercadoturistico.pdf","fecha_consulta":"2026-10-15","uso_en_el_proyecto":"Vías para enterarse de sitios turísticos (redes sociales 46.7 %); red más usada (Facebook 66.3 %)"},{"fuente_id":"inegi-mg-2025-12","titulo":"Marco Geoestadístico diciembre 2025 vía servicio web del Catálogo Único de Claves Geoestadísticas","institucion":"INEGI","tipo":"oficial","url":"https://gaia.inegi.org.mx/wscatgeo/v2/geo/mgem/21","fecha_consulta":"2026-10-15","uso_en_el_proyecto":"Límites municipales de Puebla simplificados al 4 % para el mapa"},{"fuente_id":"inegi-cabeceras","titulo":"Localidades cabecera municipal (latitud; longitud; altitud)","institucion":"INEGI","tipo":"oficial","url":"https://gaia.inegi.org.mx/wscatgeo/v2/localidades/{cvegeo_mun}0001","fecha_consulta":"2026-10-15","uso_en_el_proyecto":"Coordenadas de cada destino del catálogo"},{"fuente_id":"gob-pue-balance-2025","titulo":"Turismo eje estratégico para el desarrollo y posicionamiento de Puebla","institucion":"Gobierno del Estado de Puebla","tipo":"oficial","url":"https://puebla.gob.mx/index.php/noticias/item/22151-turismo-eje-estrategico-para-el-desarrollo-y-posicionamiento-de-puebla","fecha_consulta":"2026-10-06","uso_en_el_proyecto":"Balance 2025: visitantes; derrama; ocupación; 249 experiencias comunitarias; 12 Pueblos Mágicos; campañas digitales reportadas en impresiones"},{"fuente_id":"gob-pue-mundial-2026","titulo":"Desarrollo Turístico presenta acciones de promoción rumbo al Mundial 2026","institucion":"Gobierno del Estado de Puebla","tipo":"oficial","url":"https://puebla.gob.mx/index.php/noticias/item/22350-desarrollo-turistico-presenta-acciones-de-promocion-rumbo-al-mundial-2026","fecha_consulta":"2026-10-15","uso_en_el_proyecto":"La Secretaría colabora con creadores de contenido y no reporta indicadores de resultado"},{"fuente_id":"tianguis-2027","titulo":"Tianguis Turístico 2027 se llevará a cabo en Puebla","institucion":"Poblanerías (prensa)","tipo":"externa","url":"https://www.poblanerias.com/2026/08/tianguis-turistico-2027-en-puebla/","fecha_consulta":"2026-10-06","uso_en_el_proyecto":"Fechas (9 al 12 de marzo de 2027); expositores; compradores; derrama esperada"},{"fuente_id":"tc-2026-turismo-digital","titulo":"Gobierno del Estado impulsa innovación y creatividad con Tech Capital 2026 y FICTI","institucion":"Soy Universitario (prensa)","tipo":"externa","url":"https://soyuniversitario.com/gobierno-del-estado-impulsa-innovacion-y-creatividad-con-tech-capital-2026-y-ficti/","fecha_consulta":"2026-10-06","uso_en_el_proyecto":"Turismo digital como tema central de Tech Capital 2026 rumbo al Tianguis 2027"},{"fuente_id":"sparktoro-2026","titulo":"AIs are highly inconsistent when recommending brands or products","institucion":"SparkToro / Gumshoe","tipo":"externa","url":"https://sparktoro.com/blog/new-research-ais-are-highly-inconsistent-when-recommending-brands-or-products-marketers-should-take-care-when-tracking-ai-visibility/","fecha_consulta":"2026-10-15","uso_en_el_proyecto":"Método: medir porcentaje de visibilidad con muchos prompts repetidos"},{"fuente_id":"peec-2026","titulo":"AI search engines cite Reddit; YouTube; and LinkedIn most","institucion":"Search Engine Land (estudio de Peec AI)","tipo":"externa","url":"https://searchengineland.com/ai-search-engines-cite-reddit-youtube-and-linkedin-most-study-473138","fecha_consulta":"2026-10-15","uso_en_el_proyecto":"Fuentes más citadas por los asistentes con búsqueda"},{"fuente_id":"booking-2025-mx","titulo":"El 74 % de los viajeros mexicanos ya utiliza inteligencia artificial para planear sus viajes","institucion":"Booking.com","tipo":"externa","url":"https://news.booking.com/es-mx/el-74-de-los-viajeros-mexicanos-ya-utiliza-inteligencia-artificial-para-planear-sus-viajes-revela-bookingcom-en-estudio/","fecha_consulta":"2026-10-15","uso_en_el_proyecto":"Uso de asistentes en la planeación de viajes en México"},{"fuente_id":"tiktok-research-api","titulo":"TikTok Research Tools: Access and Eligibility","institucion":"TikTok","tipo":"externa","url":"https://developers.tiktok.com/products/research-api/","fecha_consulta":"2026-10-15","uso_en_el_proyecto":"Elegibilidad de la API de investigación (no disponible para México)"},{"fuente_id":"google-trends","titulo":"Interés de búsqueda de Google Trends, consultas con ancla","institucion":"Equipo del proyecto con datos de Google Trends","tipo":"generada","url":null,"fecha_consulta":null,"uso_en_el_proyecto":"Componente de búsqueda de la atención digital: interés mensual por destino, normalizado con un destino ancla entre tandas"},{"fuente_id":"asistentes-auditoria","titulo":"Auditoría de asistentes conversacionales","institucion":"Equipo del proyecto","tipo":"generada","url":null,"fecha_consulta":null,"uso_en_el_proyecto":"Componente de asistentes: visibilidad de cada destino y fuentes citadas, a partir de corridas fechadas sobre un corpus de prompts"}],"procesos":[{"etapa":"Catálogo","descripcion":"Destinos, municipios y términos de búsqueda en cinco idiomas, con su origen.","spec":"001"},{"etapa":"Indicadores oficiales","descripcion":"Serie mensual 2017–2026 del Observatorio Turístico, con huella de cada documento.","spec":"002"},{"etapa":"Búsqueda","descripcion":"Interés mensual en Google Trends por destino, unido entre tandas con un destino ancla.","spec":"003"},{"etapa":"Asistentes","descripcion":"Corridas repetidas de un corpus de prompts en varios idiomas, detección de menciones y de dominios citados.","spec":"006"},{"etapa":"Radar","descripcion":"Percentiles por componente, índices de atención y desempeño, brecha y cuadrante.","spec":"008"},{"etapa":"Publicación","descripcion":"Paquete de datos validado contra contratos y firmado con huellas SHA-256 que el navegador verifica.","spec":"009"}],"formulas":[{"nombre":"Percentil","expresion":"(posición − 1) / (n − 1) × 100","descripcion":"Posición del destino entre los Pueblos Mágicos; los empates promedian su posición."},{"nombre":"Índice de atención","expresion":"promedio de los percentiles de los componentes disponibles","descripcion":"Se requieren al menos dos componentes; cada componente pesa lo mismo."},{"nombre":"Brecha","expresion":"índice de atención − índice de desempeño","descripcion":"Positiva: más atención que desempeño. Negativa: más desempeño que atención."},{"nombre":"Interés ajustado","expresion":"interés × factor, con factor = promedio del ancla en la tanda de referencia / promedio del ancla en la tanda","descripcion":"Hace comparables los valores de tandas distintas de Google Trends."},{"nombre":"Visibilidad en asistentes","expresion":"k / n, con intervalo de Wilson al 95 %","descripcion":"Proporción de corridas en que el destino aparece mencionado."}],"componentes_ia":[{"id":1,"nombre":"Auditoría de asistentes","funcion":"Objeto de estudio: se mide qué destinos recomiendan y qué fuentes citan.","modelo":"OpenAI con búsqueda web y Google Gemini con Google Search","validacion":"Revisión manual de 60 respuestas estratificadas por idioma","resultado":null},{"id":2,"nombre":"Extractor de menciones en coreano y chino","funcion":"Reconoce destinos del catálogo escritos con otros alfabetos.","modelo":"Google Gemini con salida estructurada y lista cerrada de destinos","validacion":"Revisión manual de las respuestas en coreano y chino","resultado":null}],"limitaciones":["La afluencia y la derrama oficiales se derivan de la llegada de turistas a hoteles; el visitante que no pernocta no se mide de forma directa.","El radar usa solo los componentes de atención disponibles; con menos de tres no se calcula la sensibilidad del cuadrante.","Los asistentes cambian de versión sin aviso y deciden si buscan en la web; por eso cada corrida se fecha y se mide un porcentaje sobre repeticiones.","La API de un asistente no tiene la memoria ni la ubicación de una cuenta personal.","El interés de Google Trends es relativo y se normaliza con un destino ancla; los destinos de poco volumen tienen más ruido.","El cuadrante describe una posición relativa entre los Pueblos Mágicos, no una causa."]}
